{"dataset":"protocols","api_version":"v1","schema_version":"1.1.0","schema_url":"https://blockchains.github.io/blockchainlab-api/v1/schemas/protocols.schema.json","description":"Top 500 DeFi protocols by TVL (USD), excluding CEXs. Snapshot from DefiLlama; not investment advice.","generated_at":"2026-10-12T10:54:41.117Z","source":"DefiLlama","source_url":"https://api.llama.fi/protocols","built_by":"Blockchain Lab — https://blockchainlab.com","licence_note":"Data belongs to the named source; check its terms before reuse. Attribute the source and Blockchain Lab.","count":500,"data":[{"rank":1,"name":"Lido","slug":"lido","category":"Liquid Staking","chains":["Ethereum","Solana","Terra","Moonriver","Moonbeam"],"tvl_usd":24778794600,"change_1d_pct":1.8658699104828287,"change_7d_pct":-7.706880794018431,"url":"https://lido.fi/","defillama_url":"https://defillama.com/protocol/lido"},{"rank":2,"name":"Aave V3","slug":"aave-v3","category":"Lending","chains":["Ethereum","Base","Arbitrum","Plasma","Avalanche","Monad","Binance","Polygon","X Layer","xDai","Optimism","Mantle","Linea","MegaETH","Sonic","Celo","Scroll","zkSync Era","Metis","Soneium","Fantom"],"tvl_usd":17638379455,"change_1d_pct":1.6787599656188092,"change_7d_pct":-5.066588656006289,"url":"https://aave.com","defillama_url":"https://defillama.com/protocol/aave-v3"},{"rank":3,"name":"SSV Network","slug":"ssv-network","category":"Staking Pool","chains":["Ethereum"],"tvl_usd":13351275798,"change_1d_pct":1.925533067418911,"change_7d_pct":-6.20152578860241,"url":"https://ssv.network/","defillama_url":"https://defillama.com/protocol/ssv-network"},{"rank":4,"name":"LayerZero V2","slug":"layerzero-v2","category":"Bridge","chains":["Ethereum","Polygon","ApeChain","Base","Arbitrum","Binance","Solana","Tron","Flare","Plasma","Stable","Citrea","Abstract","Hyperliquid L1","Gensyn","Peaq","Somnia","Hemi","Fraxtal","Kava","Avalanche","0G","Sei","Optimism","TAC","Fantom","Goat","Chiliz","Metis","zkSync Era","Robinhood Chain","Telos","RSK","Katana","Mantle","Celo","Berachain","Cronos","Unichain","Blast","Soneium","Linea","Vana","Ink","Astar","Scroll","Flow","Sonic","Conflux","Manta","Redbelly","Mode","CORE","Story","xDai","XDC","LightLink","Monad","XPLA","Plume Mainnet","Tempo","Swellchain","Canto","Moonriver","Harmony","Degen","Moonbeam","Polygon zkEVM","X Layer","Sophon","Etherlink","Hedera","MegaETH","Rayls","BOB","Taiko","Morph","Klaytn","Op_Bnb","Lisk","World Chain","Zora","Ethereal","Codex","KiteAI","TomoChain","Nibiru","zkVerify","Bittensor EVM","Apex Fusion","Irys"],"tvl_usd":11560699345,"change_1d_pct":-0.2678832279576824,"change_7d_pct":-1.0435717198573542,"url":"https://layerzero.network/","defillama_url":"https://defillama.com/protocol/layerzero-v2"},{"rank":5,"name":"Morpho Blue","slug":"morpho-blue","category":"Lending","chains":["Ethereum","Base","Robinhood Chain","Arc","Monad","Hyperliquid L1","Pharos","Tempo","Morph","Flare","World Chain","Arbitrum","Katana","Stable","Citrea","Optimism","Sei","Etherlink","Polygon","Plume Mainnet","Unichain","MegaETH","XDC","Celo","TAC","Klaytn","Abstract","Soneium","Lisk","Hemi","Avalanche","Fraxtal","Sonic","RISE","Binance","0G","Scroll","Ink","Corn","Botanix","Zircuit","Bitlayer","Linea","xDai","Mode"],"tvl_usd":11371143101,"change_1d_pct":0.9108420639794019,"change_7d_pct":-0.4902539505937824,"url":"https://app.morpho.org","defillama_url":"https://defillama.com/protocol/morpho-blue"},{"rank":6,"name":"WBTC","slug":"wbtc","category":"Bridge","chains":["Bitcoin"],"tvl_usd":9715128397,"change_1d_pct":0.4693578841900319,"change_7d_pct":-3.094632144817382,"url":"https://wbtc.network/","defillama_url":"https://defillama.com/protocol/wbtc"},{"rank":7,"name":"Binance staked ETH","slug":"binance-staked-eth","category":"Liquid Staking","chains":["Ethereum","Binance"],"tvl_usd":9516981821,"change_1d_pct":1.9478721529447682,"change_7d_pct":-6.156713493186743,"url":"https://www.binance.com/en/wbeth","defillama_url":"https://defillama.com/protocol/binance-staked-eth"},{"rank":8,"name":"Coinbase Bridge","slug":"coinbase-bridge","category":"Bridge","chains":["Bitcoin","Ripple","Cardano","Doge","Litecoin"],"tvl_usd":8149404523,"change_1d_pct":0.6760381112758296,"change_7d_pct":-4.09452630914717,"url":"https://www.coinbase.com/","defillama_url":"https://defillama.com/protocol/coinbase-bridge"},{"rank":9,"name":"Hyperliquid Bridge","slug":"hyperliquid-bridge","category":"Bridge","chains":["Hyperliquid L1","Arbitrum"],"tvl_usd":6990632900,"change_1d_pct":0.6116188101040336,"change_7d_pct":-2.0322225121397537,"url":"https://app.hyperliquid.xyz","defillama_url":"https://defillama.com/protocol/hyperliquid-bridge"},{"rank":10,"name":"EigenCloud","slug":"eigencloud","category":"Restaking","chains":["Ethereum"],"tvl_usd":6644889105,"change_1d_pct":2.15078515876435,"change_7d_pct":-6.563990291288533,"url":"https://www.eigencloud.xyz","defillama_url":"https://defillama.com/protocol/eigencloud"},{"rank":11,"name":"Sky Lending","slug":"sky-lending","category":"CDP","chains":["Ethereum"],"tvl_usd":5940748011,"change_1d_pct":-0.8209801079354833,"change_7d_pct":0.6905234257453117,"url":"https://app.sky.money/","defillama_url":"https://defillama.com/protocol/sky-lending"},{"rank":12,"name":"Binance Bitcoin","slug":"binance-bitcoin","category":"Bridge","chains":["Bitcoin"],"tvl_usd":5686726382,"change_1d_pct":0.5312122249286944,"change_7d_pct":-3.4392891858604884,"url":"https://www.binance.com/en/collateral-btokens","defillama_url":"https://defillama.com/protocol/binance-bitcoin"},{"rank":13,"name":"SparkLend","slug":"sparklend","category":"Lending","chains":["Ethereum","xDai"],"tvl_usd":5278027623,"change_1d_pct":2.7241484294662257,"change_7d_pct":-7.2322772037621235,"url":"https://spark.finance/","defillama_url":"https://defillama.com/protocol/sparklend"},{"rank":14,"name":"ether.fi Stake","slug":"ether.fi-stake","category":"Liquid Staking","chains":["Ethereum","Base","Berachain","Optimism","Arbitrum","Scroll"],"tvl_usd":4876032092,"change_1d_pct":1.934052322422076,"change_7d_pct":-6.71279230751469,"url":"https://www.ether.fi","defillama_url":"https://defillama.com/protocol/ether.fi-stake"},{"rank":15,"name":"Ethena USDe","slug":"ethena-usde","category":"Basis Trading","chains":["Ethereum"],"tvl_usd":4751955626,"change_1d_pct":-0.10700631792740012,"change_7d_pct":-3.1621031832569173,"url":"https://www.app.ethena.fi/join/3y20d","defillama_url":"https://defillama.com/protocol/ethena-usde"},{"rank":16,"name":"JustLend V1","slug":"justlend-v1","category":"Lending","chains":["Tron"],"tvl_usd":3798862484,"change_1d_pct":0.6056312209661456,"change_7d_pct":-3.323880173508371,"url":"https://justlend.org/","defillama_url":"https://defillama.com/protocol/justlend-v1"},{"rank":17,"name":"Arbitrum Bridge","slug":"arbitrum-bridge","category":"Canonical Bridge","chains":["Ethereum"],"tvl_usd":3644689665,"change_1d_pct":1.8333054745013584,"change_7d_pct":-4.771596638580206,"url":"https://portal.arbitrum.io/bridge","defillama_url":"https://defillama.com/protocol/arbitrum-bridge"},{"rank":18,"name":"Babylon Protocol","slug":"babylon-protocol","category":"Restaking","chains":["Bitcoin"],"tvl_usd":3389603726,"change_1d_pct":0.5018687754658941,"change_7d_pct":-2.675251230923635,"url":"https://babylonlabs.io","defillama_url":"https://defillama.com/protocol/babylon-protocol"},{"rank":19,"name":"USDT0","slug":"usdt0","category":"Bridge","chains":["Ethereum"],"tvl_usd":3312985298,"change_1d_pct":0.07317106870030443,"change_7d_pct":-1.725740362833406,"url":"https://usdt0.to","defillama_url":"https://defillama.com/protocol/usdt0"},{"rank":20,"name":"JustLend sTRX","slug":"justlend-strx","category":"Liquid Staking","chains":["Tron"],"tvl_usd":3265590347,"change_1d_pct":0.4133879124001254,"change_7d_pct":-1.2606908436310675,"url":"https://app.justlend.org/strx?lang=en-US","defillama_url":"https://defillama.com/protocol/justlend-strx"},{"rank":21,"name":"Base Bridge","slug":"base-bridge","category":"Canonical Bridge","chains":["Ethereum"],"tvl_usd":3053381856,"change_1d_pct":2.030596956369095,"change_7d_pct":-6.3729996058883955,"url":"https://docs.base.org/base-chain/network-information/bridges-mainnet","defillama_url":"https://defillama.com/protocol/base-bridge"},{"rank":22,"name":"Maple","slug":"maple","category":"Lending","chains":["Ethereum","Solana"],"tvl_usd":2862772998,"change_1d_pct":0.540052642953313,"change_7d_pct":-6.521854695671607,"url":"https://www.maple.finance","defillama_url":"https://defillama.com/protocol/maple"},{"rank":23,"name":"Polygon Bridge","slug":"polygon-bridge","category":"Chain","chains":["Ethereum"],"tvl_usd":2807376290,"change_1d_pct":-1.1298013396651214,"change_7d_pct":-4.471571796850242,"url":"https://polygon.technology/","defillama_url":"https://defillama.com/protocol/polygon-bridge"},{"rank":24,"name":"Spark Liquidity Layer","slug":"spark-liquidity-layer","category":"Onchain Capital Allocator","chains":["Ethereum","Base","Arbitrum","Optimism","Unichain","Avalanche","Robinhood Chain","X Layer"],"tvl_usd":2772781768,"change_1d_pct":4.236345064428477,"change_7d_pct":2.656447198022178,"url":"https://spark.finance/","defillama_url":"https://defillama.com/protocol/spark-liquidity-layer"},{"rank":25,"name":"JustCryptos","slug":"justcryptos","category":"Bridge","chains":["Tron"],"tvl_usd":2713992958,"change_1d_pct":1.2577042094453361,"change_7d_pct":-4.746952052326122,"url":"https://just.network/token","defillama_url":"https://defillama.com/protocol/justcryptos"},{"rank":26,"name":"Sentora Curator","slug":"sentora-curator","category":"Risk Curators","chains":["Ethereum","Ink","Solana","Tempo"],"tvl_usd":2570720093,"change_1d_pct":0.18431372732581508,"change_7d_pct":1.3886812665472519,"url":"https://sentora.com/","defillama_url":"https://defillama.com/protocol/sentora-curator"},{"rank":27,"name":"Steakhouse Financial","slug":"steakhouse-financial","category":"Risk Curators","chains":["Base","Ethereum","Robinhood Chain","Solana","Monad","Arbitrum","Katana","Pol